city,state,date__,time__,shape,duration -- seconds,comments,date posted,latitude,longitude 
huntington (near),wv,2003-02-15,14:00:00,cigar,240.0,cigar-shaped ufo spotted .,4/22/2003,38.4191667,-82.4452778
atlanta,ga,2003-11-25,20:30:00,changing,180.0,Bright light which seemed to morph into wedge/cylinder with red and blue/green lights at intersection of North  Druid Hills and Lavista,12/9/2003,33.7488889,-84.3880556
clayton,nc,2003-10-20,20:45:00,fireball,15.0,witness to the too close meteor in durham&#44 nc. : meteor or ufo?,10/31/2003,35.6505556,-78.4566667
bloomington,il,2003-07-02,14:30:00,cigar,30.0,I saw a flat&#44 white-illuminated object near Bloomington&#44 IL yesterday afternoon.,7/16/2003,40.4841667,-88.9936111
concord,ca,2003-10-04,01:00:00,fireball,10.0,Oval Shaped Firey Object Near Concord Naval Weapons Station,10/7/2003,37.9780556,-122.03
cape coral,fl,2003-06-09,04:35:00,formation,420.0,I have never seen anything like this before,6/10/2003,26.5625,-81.9497222
blue springs,mo,2003-01-01,05:15:00,light,6300.0,White&#44 Red&#44 and Green lights move in unbelievable formations in the sky.,3/21/2003,39.0169444,-94.2813889
binghamton,ny,2003-10-13,20:00:00,sphere,30.0,Sphere heads north&#44 turns&#44 and then goes up&#33,10/15/2003,42.0986111,-75.9183333
windsor,ny,2003-03-23,11:59:00,changing,420.0,Kept changing shape. Started as 2 after circuling a military jet. I have pictures of the jet as well as the 2 round then cigar shaped t,4/22/2003,42.0758333,-75.6408333
ashford,wa,2003-08-15,03:00:00,oval,600.0,From outerspace to almost landing near the Southwest area of Mt Rainer  on 8/2003,10/11/2005,46.7586111,-122.0297222
cypress,tx,2003-01-17,21:30:00,circle,180.0,Driving through neighbor-hood we observed a red glowing ball of light in the sky traveling at a slow speed.  It appeared to be about 1/,2/25/2003,29.9688889,-95.6969444
panama city,fl,2003-06-23,04:24:00,light,720.0,Panama City UFO,7/16/2003,30.1586111,-85.6602778
monson,me,2003-10-19,23:30:00,triangle,900.0,First of all I&#39m 17/M and I am a Junior at HS. I was sitting at home after the 2nd World Series game&#44 when I was about ready to go to b,10/31/2003,45.2869444,-69.5016667
seattle,wa,2003-08-30,13:30:00,cylinder,1800.0,Shiny cylndrical object hovering over downtown Seattle,9/4/2003,47.6063889,-122.3308333
trenton,nj,2003-06-10,23:20:00,light,20.0,seven points of light moving together in the same direction a great speed. There paths criss-crossed,6/18/2003,40.2169444,-74.7433333
oak creek,wi,2003-12-19,22:45:00,fireball,2.0,green fireball shooting across sky,1/17/2004,42.8858333,-87.8630556
los angeles,ca,2003-06-22,03:00:00,circle,20.0,i was walking home from the movies and i was with my friend and these big lights were flashing and moving around in a triangular patter,7/16/2003,34.0522222,-118.2427778
waikiki,hi,2003-07-10,04:00:00,circle,900.0,incredable speed,12/9/2003,21.2827778,-157.8294444
maryville,mo,2003-10-15,23:00:00,light,10.0,Amber Lights in formation&#44 and then changing alignment,6/4/2004,40.3461111,-94.8722222
miami,fl,2003-10-29,19:49:00,other,5.0,An irridescent boomerang shaped object in the western sky&#44 and five minutes later it came back moving the same direction,10/31/2003,25.7738889,-80.1938889
alfred,me,2003-08-17,20:00:00,rectangle,180.0,large rectangular craft in alfred me,7/16/2006,43.4763889,-70.7188889
orange park,fl,2003-05-15,23:16:00,teardrop,900.0,lights over the eclpise,5/27/2003,30.1658333,-81.7066667
monterey,ca,2003-06-15,12:00:00,oval,15.0,Across the graveyard near Dennis the Menance park looking toward Carmel/Big Sur. Me EX Airforce&#33,7/8/2004,36.6002778,-121.8936111
tampa (south of),fl,2003-08-01,21:30:00,unknown,120.0,Weird Lights In Tampa,8/28/2003,27.9472222,-82.4586111
southern pines,nc,2003-04-30,20:50:00,light,4.0,While driving home we saw several bright&#44very white lights that seemed to merge into one larger light and streak across the sky.,5/13/2003,35.1738889,-79.3925
brookston,in,2003-05-16,21:00:00,light,1200.0,2nd of 3 Sightings from March 2003 to April 2004 - Yellow/Orange Lights in Formation,4/27/2004,40.6027778,-86.8672222
minot,nd,2003-08-24,02:00:00,oval,5.0,Oval object with 3 lights flew over town.,7/16/2006,48.2325,-101.2958333
wilmette,il,2003-05-11,23:10:00,circle,600.0,As I was sitting in my back yard it started to thunder&#44 than I looked up and there was a circle in the sky than it disapeared.,2/22/2005,42.0722222,-87.7227778
salem,or,2003-07-06,19:15:00,circle,900.0,saw 11 circle object heading due south a a very slow pace in a group formation than disappeared,7/16/2003,44.9430556,-123.0338889
birmingham,al,2003-06-13,00:18:00,disk,420.0,Me and a friend were walking on the quad at Samford University when we noticed a saucer-like object hovering aprox. 1/4 of a mile above,6/18/2003,33.5205556,-86.8025
bethel,ct,2003-03-03,11:00:00,egg,10800.0,We left our school early that day&#44 and then went bike riding in Huntington Park. We stopped for a picnic&#44 and saw some craft flying by.,4/22/2003,41.3711111,-73.4144444
parker,co,2003-10-06,20:30:00,chevron,60.0,Boomerang-shaped object travels over suburban neightborhood toward Rocky Mountains in Denver&#44 Colorado.,12/19/2003,39.5186111,-104.7608333
wahpeton,nd,2003-08-24,14:42:00,light,15.0,AN ORANGE LIGHT THE SIZE OF A STAR IN THE SKY THAT FLASHED&#44 LEFT&#44 CAME BACK AND LEFT FOR GOOD,8/28/2003,46.2652778,-96.6055556
san rafael,ca,2003-01-24,23:35:00,triangle,120.0,Triangular Object Hovers Over Marin County,3/11/2003,37.9736111,-122.53
pembroke,ga,2003-06-01,22:00:00,fireball,480.0,Unmoving Fireball with smoketrail UNDER it.,12/16/2005,32.1358333,-81.6222222
marietta,ga,2003-10-17,06:40:00,light,10.0,2 luminous objects seen traversing sky(space?) @high speed&#44 VERY high altitude,10/31/2003,33.9525,-84.55
concord,nc,2003-04-21,20:00:00,teardrop,600.0,Fork lift attacked by aliens craft,5/2/2003,35.4086111,-80.5797222
rio rancho,nm,2003-07-24,23:10:00,light,3600.0,Hovering bright light fades in and out.,8/1/2003,35.2333333,-106.6638889
athens,al,2003-11-15,22:00:00,triangle,15.0,Triangular shaped craft with three dimmly lit lights on the bottom of it and It was following something on the interstate going south.,3/23/2004,34.8027778,-86.9716667
venice,ne,2003-08-24,03:30:00,flash,3.0,Flash explanation,11/9/2004,41.2338889,-96.3533333
san jose,ca,2003-01-01,12:00:00,sphere,15.0,Noon an a Saturday or Sunday in mid January - Orange/Silver Sphere,4/27/2003,37.3394444,-121.8938889
denver,co,2003-10-13,21:20:00,chevron,45.0,V formation of white lights move with no sound,10/17/2003,39.7391667,-104.9841667
albuquerque,nm,2003-06-28,04:00:00,circle,60.0,Photos of UFO in sky above Sandia Peak&#44 NM,10/31/2003,35.0844444,-106.6505556
bend,or,2003-01-28,02:00:00,disk,900.0,A single&#44 stationary fairly large saucer/disc with rotating lights that changed colors from red to green&#44 blue and white that hovered f,2/5/2003,44.0583333,-121.3141667
baileys harbor,wi,2003-07-12,23:00:00,light,20.0,Sattelite?  ((NUFORC Note:  We observe that description of event is not inconsistent with the sighting of an Iridium satellite.  PD)),2/24/2007,45.065,-87.1241667
sacramento,ca,2003-11-15,23:30:00,unknown,2.0,We heard and felt an unearthly object pass down our street&#44 traveling incredibly fast.,11/26/2003,38.5816667,-121.4933333
new brighton,pa,2003-06-30,21:00:00,other,600.0,Black triangle surrouned by silver sphears moving south towards Pittsburgh&#44 PA.,7/16/2003,40.7302778,-80.3102778
seekonk,ma,2003-11-23,17:35:00,light,180.0,The object appeared to be a small rapidly flashing light. The object was traveling Southwest at about 40 mph&#44 at 1000-2000 ft&#44 I notice,11/26/2003,41.8083333,-71.3375
milwaukee,wi,2003-08-31,21:00:00,teardrop,600.0,More intreging then the fireworks&#44 the object hiding in the smoke.,2/1/2007,43.0388889,-87.9063889
pinos altos,nm,2003-10-16,20:17:00,unknown,1.2,Very unusual atmospheric entry of unknown Craft.,10/31/2003,32.8633333,-108.2208333
hammond,ny,2003-04-24,22:01:00,unknown,1200.0,UFO that appeared out of the corner of my eye&#44 hovering up and down while going vertically southeast.,5/2/2003,44.4488889,-75.6944444
spencer,in,2003-07-15,21:40:00,triangle,5.0,At approximately 9:40 as I was sitting in my yard star gazing&#44 something that made me think of a comet passed directly overhead.  It w,7/16/2003,39.2866667,-86.7625
york,pa,2003-11-26,06:10:00,light,600.0,A object following our van,12/9/2003,39.9625,-76.7280556
san diego,ca,2003-10-01,20:05:00,unknown,240.0,us and  the object,4/27/2007,32.7152778,-117.1563889
vernal,ut,2003-05-24,01:30:00,flash,30.0,There were strobing lights that were stationary then appeared to take off and fly away in an faster than possible.,6/3/2003,40.4555556,-109.5280556
bellerose,ny,2003-07-19,22:00:00,light,300.0,2 ufos 1 nite,7/23/2003,40.7241667,-73.7155556
colorado springs,co,2003-09-18,21:30:00,rectangle,7200.0,Very bright&#44 yellowish with dark splotches&#44 an almost perfect parallelogram&#44 seen near Pikes Peak&#44 CO.,9/24/2003,38.8338889,-104.8208333
washington,nc,2003-11-08,21:00:00,light,180.0,50-75&#39 lights hover than streak away out of sight,6/20/2005,35.5463889,-77.0525
port angeles,wa,2003-11-14,12:00:00,unknown,15.0,Unexplainably loud &#44 extremely close&#44  hovering noise which resembles a large aircraft.,11/26/2003,48.1183333,-123.4294444
seekonk,ma,2003-07-05,20:00:00,other,10.0,Jet shaped object explodes in white flash.,11/26/2003,41.8083333,-71.3375
san francisco,ca,2003-04-23,22:20:00,disk,10.0,Object moving slowly then at an extremely fast pace from the skyline,4/27/2003,37.775,-122.4183333
rainbow lakes estates,fl,2003-10-06,11:45:00,other,45.0,Ghost airplane&#44 so large dissapears with no sound in day time.,10/31/2003,29.1458333,-82.4994444
tampa,fl,2003-09-09,00:30:00,circle,120.0,A sighting of an apparent ball of flames turned into three smaller spheres... ((NUFORC Note:  Titan 4 launch from Cape Canaveral.  PD)),9/9/2003,27.9472222,-82.4586111
sonoma,ca,2003-09-23,20:00:00,other,4.0,Bright light appears in aftermath of power outage in Sonoma&#44 California on September 23&#44 2003,10/7/2003,38.2919444,-122.4569444
sedona,az,2003-09-20,18:15:00,cylinder,5.0,Silver cylinder in vertical configuration moving rapidly Westward faster than an airplane for 5 seconds before it disappeared.,7/25/2004,34.8697222,-111.7602778
pottstown,pa,2003-04-30,13:20:00,cylinder,30.0,&quot;reflective&quot; white &quot;tube&quot;  flying 100 ft or so under passenger plane during daylight.,5/2/2003,40.2452778,-75.65
martinez,ca,2003-01-16,23:35:00,circle,10.0,It was going way too fast to be a jet and it made sudden changes in direction,3/11/2003,38.0194444,-122.1330556
westland,mi,2003-08-24,14:00:00,disk,240.0,talking with freinds on drive way we saw a disk shaped object,10/31/2003,42.3241667,-83.4002778
hutchinson,ks,2003-09-19,22:30:00,triangle,20.0,The craft appeared and flew over than dissappeared.,9/28/2003,38.0608333,-97.9294444
madison,wi,2003-08-31,22:30:00,light,10.0,Bright light flying at a low level and high rate of speed - much faster than any aircraft and too low to be a conventional space craft.,9/4/2003,43.0730556,-89.4011111
austin,tx,2003-10-21,16:15:00,oval,300.0,An oval&#44 saucer-shaped object moving slowly with brilliante colors of light flashing.,10/31/2003,30.2669444,-97.7427778
boise,id,2003-12-10,22:00:00,unknown,600.0,This all happened very fast&#44 it seemed like 3 seconds but when I went back in&#44 it was ten minutes.,12/19/2003,43.6136111,-116.2025
university place,wa,2003-09-02,22:20:00,triangle,20.0,UFO over University Place/Tacoma area flying in a zig zag motion.,9/4/2003,47.2358333,-122.5491667
new york city (astoria; queens),ny,2003-02-23,20:30:00,circle,3600.0,I was out side smoking when I looked up and saw what I thought was a Large star. Then it started moving vast then very slow then not at,3/21/2003,40.7141667,-74.0063889
brewster,ma,2003-10-15,23:00:00,cigar,600.0,soldiers observe large unidentified craft as fighters give chase,8/7/2007,41.76,-70.0833333
traverse city,mi,2003-09-25,20:00:00,disk,900.0,Typical saucer shaped craft hovering close to road apx 45 feet above road,9/28/2003,44.7630556,-85.6205556
beaumont,ca,2003-08-16,23:00:00,changing,600.0,black grayish thing  ((NUFORC Note:  May not be a serious report&#44 but we are not certain.  PD)),10/27/2004,33.9294444,-116.9763889
phoenix,az,2003-04-06,16:50:00,sphere,2100.0,object moved at various speeds&#44 stopping at times and then changed  direction almost at a 90 degree angle the appeared to go up and dis,4/22/2003,33.4483333,-112.0733333
portland (i-5/lombard exit),or,2003-11-06,11:30:00,sphere,180.0,Young woman reports witnessing F-15 fighter jets approach a peculiar sphere over Interstate 5.,11/8/2003,45.5236111,-122.675
west chester,oh,2003-06-02,03:00:00,oval,1200.0,Oval craft with two strobing ovals that seemed to be propulsion - bottom of craft was saturated in a deep blue light,7/16/2003,39.0875,-81.9227778
hacienda heights,ca,2003-07-11,01:30:00,light,7200.0,Color changing craft seen above Los Angeles suburbs,7/16/2003,33.9930556,-117.9677778
vacaville,ca,2003-10-21,02:45:00,rectangle,120.0,2:25 am while satelite watching noticed an object moving sw to ne&#44with binacs&#44saw 3 objects or triangle formation now going w-east,10/31/2003,38.3566667,-121.9866667
yorktown,in,2003-04-20,02:10:00,formation,5.0,Formation of lights appeared in the sky&#44 dashed away to the horizon.,4/22/2003,40.1736111,-85.4941667
taylorsville,nc,2003-12-03,06:55:00,unknown,54000.0,Two Clouds moving at the speed of Light,12/9/2003,35.9216667,-81.1766667
reno,nv,2003-08-23,17:00:00,light,2700.0,Multiple objects over Reno,8/28/2003,39.5297222,-119.8127778
baltimore,md,2003-06-22,21:45:00,diamond,120.0,object appeared in flight pattern of aircraft&#44 then changed course and climbed out of the atmosphere.,7/16/2003,39.2902778,-76.6125
indianapolis,in,2003-10-19,17:05:00,unknown,3.0,Sky Boom possible Sonic Boom,10/31/2003,39.7683333,-86.1580556
washington,pa,2003-01-15,07:30:00,light,300.0,I live beside an airport and I seen airplanes before and this was no airplane it was a ball of light.,3/21/2003,40.1738889,-80.2463889
williamsburg,oh,2003-01-08,19:00:00,other,600.0,Ufo shaped like a plane that could hover levitate and back up.,2/5/2003,39.0541667,-84.0530556
college station,tx,2003-04-20,23:43:00,chevron,10.0,object having a V chevron shape moved rapidly below cloud cover S-N then turned east and vanished no sound.,4/22/2003,30.6277778,-96.3341667
winter springs,fl,2003-07-17,05:45:00,light,900.0,&quot;star&quot; looking object next to the moon,7/23/2003,28.6986111,-81.3083333
golden,co,2003-07-11,20:50:00,unknown,480.0,3 lights triangular shaped&#44 AAA fire&#44 lights warping out&#44 stealth-type fighter,9/24/2003,39.7555556,-105.2205556
pass christian,ms,2003-11-05,17:00:00,disk,1800.0,IT WAS ROUND AND FLAT LARGER THEN A HOUSE WITH RED LIGHTS ON THE SIDE AND WHITE LIGHTS UNDERNEATH.,11/8/2003,30.3155556,-89.2475
campbell,ca,2003-11-20,17:34:00,other,5.0,Bright white/green streak straight into Almaden Valley / Los Gatos area  - 5:34pm PST,11/26/2003,37.2872222,-121.9488889
west springfield,ma,2003-08-23,01:30:00,other,4.0,bright green tailed luminous object .,9/4/2003,42.1013889,-72.5902778
indianapolis,in,2003-10-14,23:00:00,oval,1.0,I was outside and a large brite perfect ball of lite with a mist trail behind zoomed from the sky very fast to ground just one or two b,10/31/2003,39.7683333,-86.1580556
roslindale,ma,2003-02-17,05:30:00,oval,60.0,On my way to work&#44 walking down a road&#44 about 5:30 am&#44 before sunrise&#44 I looked to the northeast and saw a descending shape&#44 like an ai,3/4/2003,42.2911111,-71.125
greenville,mo,2003-11-04,19:30:00,light,60.0,THE TWO LIGHTS CAME ON THEN JUST WENT OUT  WITH  NO SOUND OR  ANY THING .,11/8/2003,37.1272222,-90.45
kansas city,mo,2003-07-05,00:10:00,light,60.0,Saw five  star-like lights of varying brightnesses moving from NNE to SSW.  They were traveling at the same speed and direction.,7/16/2003,39.0997222,-94.5783333
palm desert,ca,2003-08-25,20:30:00,light,15.0,Three fast moving lights that changed position frequently.,8/28/2003,33.7222222,-116.3736111
myrtle beach,sc,2003-12-03,22:35:00,light,30.0,Series of lights&#44 lighting in sequence from right to left&#44 and fading out in same sequence.,12/9/2003,33.6888889,-78.8869444
palm coast,fl,2003-11-01,12:00:00,cylinder,30.0,Metallic cylinder object,12/9/2003,29.5847222,-81.2080556
oklahoma city,ok,2003-01-01,23:30:00,light,900.0,Very high and slightly north I saw a group of 3 white objects and one below them. At first I thought they were birds&#44 but they seemed a,3/21/2003,35.4675,-97.5161111
wichita falls,tx,2003-09-08,22:15:00,sphere,600.0,OBJECTS DANCING AROUND EACH OTHER,9/9/2003,33.9136111,-98.4930556
columbia,sc,2003-02-13,19:30:00,unknown,60.0,The three craft where flying with very little sound&#44  low and slow.,5/13/2003,34.0005556,-81.035
san francisco,ca,2003-12-24,23:30:00,oval,4.0,Oval object crossing the sky at incredible speed turned bright red-orange then went straight up &amp; out,2/14/2006,37.775,-122.4183333
kearney,ne,2003-02-19,19:00:00,triangle,40.0,Triangle Crafts over Kearney&#44 Nebraska,12/12/2009,40.6994444,-99.0811111
santa clarita,ca,2003-02-09,15:00:00,sphere,900.0,Small white and bright ball over Santa Clarita skies,3/11/2003,34.3916667,-118.5416667
steamboat springs,co,2003-07-13,13:00:00,light,480.0,5 or 6 lights in day sky.,7/16/2003,40.485,-106.8311111
hillsboro,or,2003-09-05,23:30:00,circle,3.0,Green ball with a pink/red tail entering our atmosphere &#44 then flying of over the horizon.,9/9/2003,45.5230556,-122.9886111
alma center,wi,2003-01-23,06:20:00,chevron,120.0,I was coming home from work.  It was very cold and the night or morning sky was clear.  For the past two mornings just before sunrise I,3/4/2003,44.4372222,-90.9111111
fresno,ca,2003-08-10,03:40:00,fireball,120.0,i was going out to do my regular prayer at that time at a close mosqe when i looked at the sky and saw a wired movment that i thought i,12/9/2003,36.7477778,-119.7713889
panama city beach,fl,2003-08-31,05:00:00,circle,20.0,It seemed to hover in small circles about three times then it shot out of site toward the southeast sky.,9/4/2003,30.1763889,-85.8055556
fort collins,co,2003-09-23,01:30:00,triangle,15.0,Strange triangle-shaped aircraft with 7 dim lights flying low&#44 fast&#44 and completely silent.,10/7/2003,40.5852778,-105.0838889
chesterfield,mo,2003-04-20,01:00:00,sphere,1.0,I saw a grate ball of fast moving flying gas.,12/3/2004,38.6630556,-90.5769444
montebello,ca,2003-08-31,00:11:00,fireball,20.0,on sunday the 24th of august at 00:14hrs we witnessed a bright red spot in the sky as red as a stop light. It looked like a star.we all,9/4/2003,34.0094444,-118.1044444
houston,tx,2003-05-17,23:10:00,other,25.0,Several gray spheres moving together in a rolling pattern smooth and silent across the Houston sky,5/27/2003,29.7630556,-95.3630556
anaheim,ca,2003-05-13,12:00:00,cylinder,120.0,My car&#44 and the ones behind me stoped&#44 and the U.F.O.&#39s landed&#44when they were gone the cars started up.,5/27/2003,33.8352778,-117.9136111
wisconsin dells,wi,2003-01-14,19:00:00,light,37800.0,We saw 10 or more&#44 very bright&#44 beautifully colored round lights&#44 darting very fast back and forth across the sky.,3/4/2003,43.6275,-89.7708333
dallas,tx,2003-11-19,05:45:00,light,3600.0,Light in the Western Sky,11/26/2003,32.7833333,-96.8
palmdale,ca,2003-12-22,09:00:00,changing,60.0,Object was moving west to east when first sighted,1/17/2004,34.5794444,-118.1155556
north myrtle beach,sc,2003-09-15,20:30:00,light,2400.0,Between the hours of 20:00 adn 21:00 on 9/15/2003&#44 looking out over the ocean. We saw one round light splint into two then disappear. T,9/24/2003,33.8158333,-78.6802778
thomson,ga,2003-10-29,00:15:00,flash,5.0,I&#39ve seen a bright flash of light three times in the same area.,10/31/2003,33.4705556,-82.5047222
shell knob,mo,2003-10-06,04:00:00,sphere,900.0,UFO SEEN HOVERING OVER FIELD ON ROUTE 13 ABout a 1/4 mile from Washington Street. THis was no plane&#33 Had no sound nothing&#33 Beam of ligh,10/7/2003,36.6322222,-93.6341667
emsworth,pa,2003-12-20,21:30:00,unknown,120.0,3 Similar Slow Moving Crafts In The Sky.,1/17/2004,40.51,-80.0947222
henderson,nc,2003-08-20,21:30:00,formation,120.0,They were in a straight line with blinking lights,8/28/2003,36.3294444,-78.3994444
fair oaks,ca,2003-01-15,23:00:00,circle,600.0,Glowing orange object,3/11/2003,38.6447222,-121.2711111
san antonio,tx,2003-05-29,21:06:00,light,50.0,Orbital Sighting Not Satellite or Meteor,6/10/2003,29.4238889,-98.4933333
columbus,oh,2003-09-15,00:00:00,other,600.0,Large black cube shaped UFO spotted; Columbus&#44  OH.  Time seemed to stop&#33,6/12/2008,39.9611111,-82.9988889
san diego,ca,2003-11-23,21:15:00,chevron,3.0,4 sphere red chevron,11/26/2003,32.7152778,-117.1563889
swannanoa,nc,2003-10-20,20:00:00,fireball,4.0,On Mon. Oct. 20&#44 2003 at approximately 8:45 PM I saw a fireball like object streak across sky in a east to west direction.,10/31/2003,35.5977778,-82.4
bloomington,in,2003-10-11,20:30:00,disk,180.0,Saucer shaped craft with kaleidoscope lights.,10/15/2003,39.1652778,-86.5263889
deming,nm,2003-11-04,20:50:00,disk,15.0,Orange glowing disk  south west of Deming NM  on night of 11/04/03,11/8/2003,32.2686111,-107.7580556
sycamore,ga,2003-12-06,19:15:00,teardrop,900.0,We saw 2  large objects in the sky and the colors were fascinating&#33,12/9/2003,31.6741667,-83.6375
sacramento,ca,2003-12-31,21:00:00,oval,10.0,Bright oval shaped object&#44 flameing center&#44 large tail&#44 varying magnitude&#44 moving across sky rapidly.,3/9/2004,38.5816667,-121.4933333
san jose,ca,2003-05-26,15:00:00,changing,1200.0,Skies over San Jose on this Memorial Day were full of Chemtrails. During Barbecue our party observed what we thought at first to be two,5/27/2003,37.3394444,-121.8938889
sedona,az,2003-07-05,23:15:00,triangle,120.0,A black triangle was seen flying over Sedona&#44 AZ the evening of July 5&#44 2003 by six eyewitnesses,7/16/2003,34.8697222,-111.7602778
holden,ma,2003-04-01,02:00:00,rectangle,300.0,The vehicle looked like a &quot;flying car&quot; with three large bright headlights flew slowly without sound and at tree top level.,4/22/2003,42.3516667,-71.8638889
miami,fl,2003-02-15,21:30:00,unknown,600.0,Two pilots&#44 we were coming in for a landing at night at Tamiami airport. The tower was closed so we were communicating with flight serv,3/11/2006,25.7738889,-80.1938889
plains,pa,2003-10-14,19:00:00,triangle,60.0,The object was low and stationary. It appeared to be triangular in shape.It produced a white beam of light. There were red&#44 white &#44 and,10/15/2003,41.2752778,-75.8505556
ozone park,ny,2003-11-08,20:30:00,triangle,900.0,Sliver or Dark Grey Colored Boomerang With No Lights Or Sound,11/11/2003,40.6766667,-73.8441667
morris,il,2003-07-10,22:00:00,light,15.0,Red light circling over an area&#44 then shooting off.,4/16/2005,41.3572222,-88.4211111
hudson,oh,2003-02-27,15:40:00,circle,40.0,observed objects for 2-3 min&#44there were 10-12- of them moving in and out&#44 lined up one headed north then vanished,3/4/2003,41.24,-81.4408333
delaware,oh,2003-08-28,01:30:00,light,600.0,Staying up late is sometimes a part of being a student&#33  Right before going to sleep&#44 after spending several hours of reading&#44 I often,9/4/2003,40.2986111,-83.0680556
camarillo,ca,2003-12-09,18:30:00,light,1800.0,strange light above air base in southern California,12/19/2003,34.2163889,-119.0366667
manchester,nh,2003-08-08,15:15:00,diamond,30.0,shiny diamond object that made a pocket in the clear blue sky and disappeared through it leaving a whisp of cloud,11/26/2003,42.9955556,-71.4552778
tacoma,wa,2003-09-28,04:00:00,unknown,300.0,Tacoma/Puyallup - Light that moved &amp; changed color,10/7/2003,47.2530556,-122.4430556
warner robins,ga,2003-12-31,16:45:00,oval,600.0,There was 3 round circular objects&#44 one was Red&#44 they first appeared to be stars&#44 it was 4:45 in the afternoon&#44 there were no others.,1/17/2004,32.6208333,-83.6
fresno,ca,2003-04-11,20:10:00,formation,1200.0,Triangular light pattern over Fresno CA,4/22/2003,36.7477778,-119.7713889
el paso,tx,2003-08-31,13:15:00,circle,600.0,A large white round object moving slowly across the sky and helicopters flying near the vicinity.,9/4/2003,31.7586111,-106.4863889
littleton,co,2003-05-24,19:45:00,other,720.0,Large black object that never moved for 12 min,5/27/2003,39.6133333,-105.0161111
poulsbo,wa,2003-11-06,21:00:00,fireball,10.0,Large Green lighted object falling from sky.,11/26/2003,47.7361111,-122.6452778
highland,il,2003-02-08,02:03:00,triangle,120.0,triangle passes by in the sky,4/22/2003,38.7394444,-89.6711111
granville,ia,2003-10-31,21:30:00,cigar,240.0,5 strange lights hoevering above ground,2/1/2007,42.9855556,-95.8733333
grand isle,me,2003-12-28,20:25:00,triangle,600.0,silent arch of pulsing lights.,1/17/2004,47.3052778,-68.1525
columbus,oh,2003-01-31,19:30:00,other,40.0,On Jan. 31st 2003 I believe what I saw classifies as an unidentified flying objects that was hovering over the top of trees in fron,2/5/2003,39.9611111,-82.9988889
crystal,nm,2003-07-05,10:30:00,cigar,50.0,a silvery object was moving across the clear blue sky at a slow speed.,7/16/2003,36.0458333,-108.9655556
burbank,ca,2003-02-14,20:48:00,light,600.0,Strange orange light over Burbank Ca&#44 it appeard to land in one of my sightings.,3/11/2003,34.1808333,-118.3080556
jacksonville,fl,2003-05-05,21:22:00,formation,120.0,Triangular formation of lights observed in a telescope&#44 moving from west to east.,5/9/2003,30.3319444,-81.6558333
yelm,wa,2003-10-14,11:30:00,oval,900.0,Oval obj: FLASHING RED N WHITE KEOPPEN RD YELM WA,10/31/2003,46.9422222,-122.6047222
