city,state,date__,time__,shape,duration -- seconds,comments,date posted,latitude,longitude 
north highlands,ca,2007-03-23,21:20:00,light,1200.0,Bright&#44 sometimes pulsating&#44 light &quot;dancing&quot; about in western sky at about 10 degrees above horizon for 20 minutes.,4/27/2007,38.6858333,-121.3711111
bremerton,wa,2007-01-29,18:45:00,light,1200.0,A red light traveling at a slow speed was visible for 20 mintes and was seen to hover four times.,2/1/2007,47.5675,-122.6313889
exeter,nh,2007-01-24,18:00:00,changing,900.0,Just after sunset&#44my wife and I observed a large&#44round&#44glowing white orb with blue&#44green&#44and purple blinking lights in the middle.,2/1/2007,42.9813889,-70.9483333
albuquerque,nm,2007-02-20,20:45:00,chevron,90.0,Watched a vee formation of 7 glowing gold chevron/B-1 bomber shaped objects fly silently overhead in night sky.,4/27/2007,35.0844444,-106.6505556
ambrose,ga,2007-09-22,20:30:00,oval,2.0,I was standing in my backyard watching the sunset and taking a couple photos when i noticed an oval shaped light hovering over my famil,8/5/2009,31.5936111,-83.0144444
redondo beach,ca,2007-10-14,16:00:00,circle,180.0,Ufo sigting in redondo beach  on a sunday afternoon,11/28/2007,33.8491667,-118.3875
orange park,fl,2007-04-30,13:00:00,rectangle,300.0,Cloud shield maker over Clay County&#44 Florida.,6/12/2008,30.1658333,-81.7066667
chattanooga,tn,2007-12-13,19:30:00,diamond,600.0,6 Diamond shaped objects over Chattanooga&#44 TN,3/4/2008,35.0455556,-85.3097222
willow grove,pa,2007-03-02,22:00:00,other,3600.0,Multiple unidentified objects spotted near military base.,3/8/2007,40.1438889,-75.1161111
highspire,pa,2007-11-08,22:15:00,fireball,10.0,bright green ball with red tail crosses over southcentral Pennsylvania,11/28/2007,40.2108333,-76.7913889
itasca,il,2007-07-30,22:30:00,light,2.0,Bright white lights flash across the night sky,8/7/2007,41.975,-88.0072222
franklin,tn,2007-09-25,18:40:00,triangle,120.0,Black Triangle or dark colored unidentified object south of Nashville at dusk,10/8/2007,35.925,-86.8688889
madison,wi,2007-07-10,16:00:00,light,900.0,i have pictures of brilliant streaks of light&#44 by the fastest moving object i ve ever seen.,11/21/2010,43.0730556,-89.4011111
irvine,ca,2007-10-12,22:00:00,circle,600.0,Bright white circles of light on one side&#44 red light on trailing edge of other side. Amazing flight patterns.,11/28/2007,33.6694444,-117.8222222
new kensington,pa,2007-02-27,01:00:00,other,240.0,Eastward object in SW Pennsylvania,4/27/2007,40.5697222,-79.765
san marcos,ca,2007-11-13,20:30:00,formation,900.0,we are seeing a 5 light formation in a cross pattern for many minutes with little red lights erratically flying around the right side,11/28/2007,33.1433333,-117.1652778
mcdonough,ga,2007-11-13,00:00:00,diamond,30.0,Diamond like crafts flying low.,11/28/2007,33.4472222,-84.1469444
peyton,co,2007-02-07,20:20:00,light,45.0,Helicopter following light&#44 Peyton Colorado,2/24/2007,39.0288889,-104.4825
everett,wa,2007-11-13,20:00:00,other,3.0,Silent Orange Flying Object in the clear night sky.,11/28/2007,47.9791667,-122.2008333
hershey,pa,2007-12-12,17:00:00,formation,30.0,Driving North on Bullfrog Valley Rd. I saw a red and white light.  This light turns into 8-10 lights of the same. They faded in and out,3/4/2008,40.2858333,-76.6505556
fort smith,ar,2007-02-18,17:00:00,light,2700.0,white disk light over fort smith arkansas appeared in nw moved very slowly to the ne then suddenly disapperared,2/24/2007,35.3858333,-94.3983333
boulder,co,2007-05-10,01:00:00,circle,900.0,Strange formations&#44 bright blue/ red / green lights forming in different locations in Boulder.,6/12/2007,40.015,-105.27
boulder,co,2007-09-16,01:00:00,triangle,9.0,A large triangle craft&#44 with about 20 red lights blinking once per second. The craft appeared to be very large&#44 about twice the size of,10/8/2007,40.015,-105.27
council bluffs,ia,2007-01-10,23:05:00,chevron,7200.0,I was driving near the industrial estate when a bright light appeared on the horizon. It began to climb into the sky and grow larger. T,2/1/2007,41.2619444,-95.8608333
jacksonville,fl,2007-11-01,20:00:00,light,10.0,NAS plane with bright red and blue lights around it followed by a bright white ball of light.,1/10/2009,30.3319444,-81.6558333
davenport,ia,2007-05-15,23:40:00,triangle,480.0,Pyramid constilation UFO slowly move across night sky,4/18/2012,41.5236111,-90.5775
rock falls,wi,2007-10-20,20:00:00,light,900.0,Arcing green lights viewed at night in rural Wisconsin.  ((NUFORC Note:  Report is suggestive to us of advertising lights.  PD)),11/28/2007,44.7186111,-91.6897222
hertford,nc,2007-11-01,19:30:00,light,8.0,bright star flashed then receded.  ((NUFORC Note:  Possibly the flare from an Iridium satellite.  PD)),11/28/2007,36.19,-76.4663889
las vegas,nv,2007-03-04,11:00:00,circle,660.0,One day&#44as i was looking outside of my room a circle shaped light beeming object appeared out of the blue&#44the light werew bright/the ai,4/27/2007,36.175,-115.1363889
mapleton (nearby),ut,2007-07-05,15:20:00,oval,20.0,Grey Oval over interstate 15&#44 Utah County,8/7/2007,40.1302778,-111.5777778
morenci,mi,2007-06-19,22:30:00,unknown,20.0,2 white lights heading from souther Michigan to Ohio traveling one behind the other at a high rate of speed. ((NUFORC Note:  ISS.  PD)),8/7/2007,41.7194444,-84.2180556
bedford park,il,2007-09-14,07:45:00,circle,900.0,A group of circular shaped lights - 30 - 50 in total seen by 7 people at 7:45am in Bedford Park&#44 IL,10/8/2007,41.7627778,-87.8
robinson,tx,2007-12-04,22:00:00,light,3600.0,Bright colored lights that stayed fixed in one location for more than an hour&#33  ((NUFORC Note:  Sighting of Sirius??  PD)),3/4/2008,31.4675,-97.1144444
akron,oh,2007-09-16,17:00:00,light,120.0,I was walking through the local university campus Sunday the 16th of September. I was the only person walking on the commons area at th,10/8/2007,41.0813889,-81.5191667
lafayette,ca,2007-03-13,03:00:00,unknown,300.0,2 beams of light shining thru the skylight in bathroom,4/27/2007,37.8858333,-122.1169444
grand forks,nd,2007-04-14,22:40:00,light,10.0,Satiellite looking objects about to intersect when one changed its direction of travel.,4/27/2007,47.9252778,-97.0325
warren,mi,2007-09-28,20:23:00,formation,20.0,Dynamic formation of five fast-moving&#44 silent objects flying over Detroit area,10/8/2007,42.4775,-83.0277778
hyannis,ma,2007-11-02,23:00:00,diamond,7200.0,My sister saw something highly unusual from the windows of her second floor apartment in Hyannis&#44 Massachusetts. She is 56 years old an,6/12/2008,41.6527778,-70.2833333
little valley,ny,2007-08-23,23:00:00,rectangle,120.0,Large&#44 slender craft over Little Valley&#44 New York,10/8/2007,42.2525,-78.8058333
covington,ga,2007-12-06,00:00:00,light,1200.0,Bright light and flashing in covington ga,3/4/2008,33.5966667,-83.8602778
tulare,ca,2007-06-25,21:00:00,rectangle,720.0,Flashing strobe lights moving and stopping midair&#44 changing direction quickly and changing altitude.,8/7/2007,36.2077778,-119.3463889
phoenix,az,2007-01-06,01:01:00,changing,2700.0,Night time Object seen over Phoenix&#44 Az.. Changing shapes and colors.  ((NUFORC Note:  Sighting of a celestial body??  PD)),2/1/2007,33.4483333,-112.0733333
fairfax,va,2007-08-15,00:44:00,unknown,120.0,Four flashing white lights,10/8/2007,38.8461111,-77.3066667
ewing,ky,2007-03-07,19:30:00,teardrop,1200.0,Tear-drop shaped lights.,7/3/2013,38.4272222,-83.8633333
centralia,wa,2007-01-07,07:30:00,circle,5.0,GREEN BALL FLYING FAST WITH NO SOUND,2/1/2007,46.7163889,-122.9530556
san diego,ca,2007-12-22,18:00:00,light,300.0,Orange/yellow lights seen from Ocean Beach&#44 San Diego&#44 rising till no longer visible.,1/21/2008,32.7152778,-117.1563889
chillicothe,oh,2007-11-16,19:00:00,fireball,600.0,5 red orange fireball looking things,11/28/2007,39.3330556,-82.9825
blue springs,mo,2007-11-01,08:37:00,disk,5.0,MISSOURI INVESTIGATORS GROUP Report:  Looking at a distance past the upcoming stoplight&#44 I saw a round object in the sky.,12/12/2009,39.0169444,-94.2813889
warner robins,ga,2007-10-24,06:55:00,light,600.0,red light moveing fast  500 Lights On Object0: Yes,11/28/2007,32.6208333,-83.6
lac du flambeau,wi,2007-07-15,17:00:00,light,30.0,very bright light with tail&#44 traveled slowly&#44 about 5&#44000 feet in the air&#44 was NOT comet.,3/19/2009,45.9697222,-89.8919444
orlando,fl,2007-03-26,20:45:00,cylinder,600.0,fire cylinder over the Orlando International Airport...,4/27/2007,28.5380556,-81.3794444
glassboro,nj,2007-08-28,23:00:00,other,180.0,Two  boomerang shaped objects in washington township Nj,10/8/2007,39.7027778,-75.1122222
blairstown,nj,2007-10-14,21:50:00,triangle,300.0,While on my way to go to bed&#44 I looked out my window and saw a triangle shaped craft. Now it had lights on its 3 ends&#44 which showed the,11/28/2007,40.9827778,-74.9608333
zion,il,2007-09-23,21:00:00,unknown,60.0,3 round white lights in a triangle formation,8/12/2008,42.4461111,-87.8327778
paddock lake,wi,2007-05-01,21:50:00,fireball,5.0,Green fireball in western Wisconsin sky,6/12/2007,42.5775,-88.105
columbia,mo,2007-07-03,16:30:00,cigar,60.0,Black cigar shaped object flying north of Columbia&#44 Missouri on 7/3/07.,8/7/2007,38.9516667,-92.3338889
woodland,ca,2007-06-18,14:00:00,cigar,60.0,Cigar shaped object flying through sky then suddenly vanished.,8/7/2007,38.6786111,-121.7722222
stafford,va,2007-08-28,11:30:00,other,300.0,Unknown sighting,11/28/2007,38.4219444,-77.4086111
chicago,il,2007-07-21,21:45:00,light,10.0,Bright Light leaves amber trail,8/7/2007,41.85,-87.65
arcadia,fl,2007-10-12,08:15:00,formation,65.0,It was real and I have NEVER seen anthing like it&#44 I reported it to the police who came to my house and took an affidavit,11/28/2007,27.2155556,-81.8586111
salem,or,2007-10-05,20:00:00,other,180.0,I saw a flying craft that was unlike anything I&#39ve ever seen.,11/28/2007,44.9430556,-123.0338889
appleton,wi,2007-10-12,21:30:00,circle,300.0,Blue circluar ufo,11/28/2007,44.2619444,-88.4152778
streamwood,il,2007-07-28,20:24:00,oval,15.0,Oval Formation of 8 or 9 Bright White and Red Lights - Then Object changed position so only 3 Lights Visible - Streamwood&#44 IL,8/14/2007,42.0255556,-88.1783333
westchester (northern),ny,2007-05-08,18:21:00,disk,30.0,Small disk shaped object high in sky quickly appeared and disappeared on May 8th at 6:21pm.,6/12/2007,40.8472222,-73.8552778
shelbyville,il,2007-08-29,18:05:00,cigar,20.0,my daughters and son were waiting on church bus. My daughter suddenly points to object cylinderical&#44very long shiny.  For a moment  it,10/8/2007,39.4063889,-88.79
tucson,az,2007-06-16,20:00:00,light,300.0,I was sitting in my backyard talking with a friend on my cell phone. Four bright red lights in the southwest caught my eye. The lights,10/8/2007,32.2216667,-110.9258333
belmont,ma,2007-07-06,19:00:00,other,180.0,((HOAX??))  I saw something  unbelievable.,7/4/2011,42.3958333,-71.1791667
houston,tx,2007-10-02,06:30:00,light,600.0,Strobbing Orb  ((NUFORC Note:  Venus??  PD)),10/8/2007,29.7630556,-95.3630556
richmond,mi,2007-08-10,22:15:00,oval,120.0,Steady moving oval object with an orange glow as if on fire.,8/14/2007,42.8091667,-82.7558333
corona,ca,2007-07-28,13:00:00,cylinder,2.0,BRIGHT SILVER OBJECT APPEARING THEN BECOMING INVISIBLE,8/14/2007,33.8752778,-117.5655556
warminster,pa,2007-04-29,23:00:00,triangle,3600.0,moving very slow. heading south towards willow grove base. jets were deployed.  ((NUFORC Note:  Possibly not a serious report?  PD)),6/12/2007,40.2066667,-75.1
detroit,mi,2007-04-09,05:00:00,light,30.0,bright comet like light streaked across the michigan sky line,4/27/2007,42.3313889,-83.0458333
san francisco,ca,2007-12-08,22:30:00,light,60.0,Steady light&#44 stopping&#44 and changing direction in the sky.,3/4/2008,37.775,-122.4183333
springville,al,2007-02-28,06:00:00,unknown,1200.0,3 bright yellowish white lights&#44side by side appeared around 6 AM&#44 in the dense woods across the road from our house.,3/8/2007,33.775,-86.4716667
palatine,il,2007-02-08,19:50:00,unknown,180.0,Solid red lights over O&#39hare airport.,2/24/2007,42.1102778,-88.0341667
portland,ct,2007-07-08,22:00:00,fireball,300.0,Fireball&#44very low and then went higher into the sky and dissappeared,8/7/2007,41.5727778,-72.6411111
miami lakes,fl,2007-01-01,16:30:00,changing,1200.0,strange objects on new year&#39s day&#44 2007 in Miami Lakes&#44 Fl on a perfectly clear and sunny day,2/1/2007,25.9083333,-80.3088889
cabool,mo,2007-03-08,19:45:00,light,600.0,Two sets of red lights in southeastern sky.,4/27/2007,37.1238889,-92.1011111
collierville,tn,2007-01-19,23:10:00,triangle,60.0,flying triangle one blue light in the front and two red lights in each corner&#44 made no sound,2/1/2007,35.0419444,-89.6644444
new britain,ct,2007-07-15,22:30:00,light,10.0,Bright neon green ball of light flew across sky,10/31/2008,41.6611111,-72.78
rohnert park,ca,2007-04-02,09:00:00,unknown,30.0,((HOAX??)) I was coming home when i saw a blue light in the sky i tried to follow it but it was really fast so I went home.,4/27/2007,38.3397222,-122.7
clinton,ct,2007-09-26,04:38:00,unknown,40.0,A gold&#44yellowish light going across the sky in space... up with the stars&#33,10/8/2007,41.2786111,-72.5280556
charlotte,nc,2007-04-22,09:55:00,fireball,1.0,I thought it was a firework at first...then I realized it was too big and way too fast.  We live about 15 miles from airport....this wa,4/27/2007,35.2269444,-80.8433333
grand rapids,oh,2007-11-03,14:30:00,rectangle,10.0,Small white and blue rectangular object scares dog and boy.,11/28/2007,41.4119444,-83.8644444
gig harbor,wa,2007-11-02,21:15:00,triangle,10.0,Medium sized triangular shaped craft hovered and shot off extremely fast,11/28/2007,47.3294444,-122.5788889
king,nc,2007-02-04,21:45:00,unknown,2.0,Was the brightest red to orange colored object I have ever seen in the sky.,2/24/2007,36.2805556,-80.3594444
bakersfield,ca,2007-04-14,21:30:00,light,2400.0,Star like object turn lights off after being flashed with light and took off&#44 then came back 15 min later.,4/27/2007,35.3733333,-119.0177778
arroyo grande,ca,2007-03-12,01:00:00,triangle,3600.0,triangular shape with colorful lights hovering above oceano dunes&#44 oceano&#44 california,4/27/2007,35.1186111,-120.5897222
medford,or,2007-10-23,20:30:00,unknown,300.0,Changing color&#44 rotating lights with a hazy&#44 &quot;v-shaped&quot; short light beam beneath.,11/28/2007,42.3266667,-122.8744444
miami,fl,2007-01-31,14:00:00,light,900.0,Miami Florida Jan 31/2006  On Wednesday January 31&#44 2006 at around 2:00 pm Eastern Standard time&#44 while I was eating lunch outside a re,2/24/2007,25.7738889,-80.1938889
pleasanton,ca,2007-11-01,20:40:00,disk,180.0,Large saucer shaped object&#44 with many windows&#44 which was flying slow and low to the ground  was seen tonight.,11/28/2007,37.6625,-121.8736111
boynton beach,fl,2007-02-10,08:00:00,light,30.0, a ufo was orbiting mars&#33&#33&#33  ((NUFORC Note:  Student report.  PD)),3/4/2008,26.525,-80.0666667
san lorenzo,ca,2007-06-14,02:00:00,light,7200.0,transforming light with shooting fireball,8/7/2007,37.6811111,-122.1233333
los angeles,ca,2007-01-26,15:40:00,light,600.0,Star like object moving across the sky very slowly and stops moving.,2/24/2007,34.0522222,-118.2427778
berkeley,ca,2007-07-28,11:00:00,light,10.0,Two bright dots traveling silently in sunny blue sky&#44 bay area California,8/7/2007,37.8716667,-122.2716667
seattle,wa,2007-01-02,00:00:00,fireball,30.0,((HOAX))  it was really fast&#44 faster then any airplane. It was red&#44 made a microwave sound. Thats it&#44 because I was drunk.,6/12/2007,47.6063889,-122.3308333
mokena,il,2007-01-17,20:02:00,triangle,180.0,Triangular craft with red lights in Mokena&#44 IL,2/1/2007,41.5261111,-87.8891667
papillion,ne,2007-03-20,09:00:00,cigar,30.0,Two cigar shapes traveling the same direction and speed and aproximately one mile away.,8/7/2007,41.1544444,-96.0419444
seattle,wa,2007-07-09,12:30:00,unknown,1800.0,Odd object over Seattle&#44 perfectly clear day&#44 airplanes and bird in frames for comparison,8/7/2007,47.6063889,-122.3308333
los osos,ca,2007-07-20,23:00:00,diamond,900.0,Low stationary extremely bright light&#44 similar to Venus in one place for 10 to 15 mins&#44 snapped off lights and lifted off and left,8/7/2007,35.3111111,-120.8313889
boyne falls,mi,2007-10-04,23:00:00,triangle,8.0,Triangle; no lights or sound,10/8/2007,45.1680556,-84.9161111
shoreline,wa,2007-11-13,20:00:00,fireball,2.0,Very large bright green fireball,11/28/2007,47.7558333,-122.3402778
westville,fl,2007-04-22,22:20:00,triangle,7.0,It had four greenish-blue&#44 dim lights on the bottom; one in the middle towards the rear and one at each corner.,4/27/2007,30.7744444,-85.8516667
salina,ks,2007-12-30,21:05:00,disk,5.0,One white circurlar spotting,2/14/2008,38.8402778,-97.6111111
seattle,wa,2007-06-07,22:45:00,light,300.0,Strobe-type light moving quickly,6/12/2007,47.6063889,-122.3308333
davenport,fl,2007-03-20,06:15:00,light,30.0,Pulse Plasma light / craft  ((NUFORC Note:  Possibly a flare from an Iridium satellite.  PD)),4/27/2007,28.1611111,-81.6019444
forked river,nj,2007-09-15,23:10:00,triangle,600.0,2 Triangle shaped objects hovering in pine Barrens on Lacey Road Forked river NJ,10/8/2007,39.8397222,-74.1905556
tucson,az,2007-09-11,09:00:00,changing,30.0,Golden triangular object reshaping into golden half moon or dome before disappearing.,10/8/2007,32.2216667,-110.9258333
lake dallas,tx,2007-09-25,05:31:00,rectangle,180.0,I saw a rectangular shaped object on the western horizon glowing orange I saw a jet intercepting the object and then abruptly turn away,10/8/2007,33.1191667,-97.0252778
north hollywood,ca,2007-06-23,21:30:00,circle,900.0,6/23/07 Total of five round objects against the moon&#39s light&#44 but not all at the same time.,8/7/2007,34.1722222,-118.3780556
medford,or,2007-09-11,21:40:00,triangle,6.0,A triangular set of three dim or orange lights were seen moving very fast and silently across the night sky over Medford&#44 Oregon.,10/8/2007,42.3266667,-122.8744444
southington,ct,2007-05-15,23:40:00,fireball,15.0,A fireball-like object twice the size of a star appeared and moved north with great speed&#44 followed by a flash of light.,6/12/2007,41.5963889,-72.8780556
shreveport,la,2007-04-30,22:00:00,oval,5.0,Multiple-type UFOs are witnessed multiple times&#44 in multiple states&#44 near U.S.A.F. bases in LA and CO.,6/12/2007,32.525,-93.75
las cruces,nm,2007-06-11,09:00:00,changing,25200.0,Bright object in sky moving at extremely fast speed and changing course abruptly,6/12/2008,32.3122222,-106.7777778
edmond,ok,2007-08-20,22:05:00,sphere,120.0,Two bright star looking objects moving at unbelievale speed. Too high to be man made light.  ((NUFORC Note:  ISS and STS??  PD)),10/8/2007,35.6527778,-97.4777778
pontiac,mi,2007-01-09,07:35:00,sphere,1200.0,..It split into two halves-like a &quot;Pac-Man&quot; mouth.,2/1/2007,42.6388889,-83.2911111
brentwood,ca,2007-04-24,21:40:00,circle,300.0,Bright Orange round object sighted in the Eastern Night sky moved south and dissappeared.,4/27/2007,37.9319444,-121.6947222
aurora,co,2007-09-12,03:00:00,egg,300.0,Two flashing objects in night sky.,10/8/2007,39.7294444,-104.8313889
the villages,fl,2007-07-15,11:45:00,light,600.0,unusual vision,8/7/2007,28.9333333,-81.9486111
williston,nd,2007-06-19,22:50:00,light,240.0,circle lights&#44 white colored.  ((NUFORC Note:  Space Shuttle w/ ISS??  PD)),8/7/2007,48.1333333,-103.6333333
memphis,tn,2007-12-24,20:30:00,unknown,10.0,Four bright orange lights in a perfect square that was slowly drifting before separating and disappearing.,3/4/2008,35.1494444,-90.0488889
memphis,tn,2007-04-01,20:30:00,triangle,6300.0,At aprox. 8:20pm I saw a craft in the sky slowly moving from the east to the west. The craft stoped and rotated and other lights were v,4/27/2007,35.1494444,-90.0488889
halifax,pa,2007-12-15,03:04:00,oval,10.0,Green meteor,3/4/2008,40.4680556,-76.9322222
rancho cucamonga,ca,2007-04-07,22:45:00,light,5.0,Bright orange ball of light.,4/27/2007,34.1063889,-117.5922222
surprise,az,2007-10-14,21:25:00,other,1.5,Streak in sky changes direction,11/28/2007,33.6305556,-112.3325
plainfield,il,2007-08-01,21:15:00,unknown,15.0,the object stopped in mid air and changed directions 4 times&#44 then flew away north,8/7/2007,41.6269444,-88.2038889
baton,nc,2007-12-10,19:20:00,other,1500.0,slow-moving comet like tail with single strobe over western north carolina.  ((NUFORC Note:  Missile venting fuel in space.  PD)),1/21/2008,35.8072222,-81.5319444
yakima,wa,2007-07-11,23:00:00,unknown,600.0,it was a strobing light&#44 I could see it moving in weird directions.,8/7/2007,46.6022222,-120.5047222
elmsford,ny,2007-04-09,18:05:00,circle,2.0,Dark circular object floating stock still in the air. Was not seen when photo was shot. It&#39s not in any of the other photos taken.,4/27/2007,41.055,-73.8205556
discovery bay,ca,2007-11-02,20:15:00,other,1800.0,Object which looked like a lighted jellyfish pulsating around a star below and to the right of Cassiopea.,11/28/2007,37.9086111,-121.5991667
alton,nh,2007-09-05,13:00:00,cigar,60.0,Possible Missile Test.,10/8/2007,43.4522222,-71.2180556
stanwood,wa,2007-07-03,13:00:00,disk,10.0,saucer shaped disk moving across clouds,8/7/2007,48.2413889,-122.3694444
conshohocken,pa,2008-10-06,11:00:00,cigar,600.0,A silver cigar shaped object remained stationary very high over head&#44well above the horizon close to zenith in the western sky for abou,1/10/2009,40.0791667,-75.3019444
georgetown,tx,2008-11-17,18:47:00,triangle,600.0,Dark triangle-shaped object spotted while driving on I-35 in Georgetown&#44 TX,1/10/2009,30.6325,-97.6769444
lancaster,oh,2008-04-06,18:00:00,sphere,60.0,ABOUT TWO HOURS BEFORE SUNSET&#44 I LOOKED STRAIGHT UP AND SAW TWO VERY BRIGHT SILVER BB OBJECTS THAT WERE MUCH HIGHER THAN JET AIRCRAFT T,4/17/2008,39.7136111,-82.5994444
brady,tx,2008-08-02,22:30:00,other,900.0,Witnessed&#44 two gray objects flying without lights and sound.,10/31/2008,31.135,-99.3347222
lancaster,ca,2008-01-20,21:52:00,circle,90.0,huge bright light moving crazily in the sky and then disappearing in lancaster&#44 california and have a video.,2/14/2008,34.6980556,-118.1358333
midland,mi,2008-07-20,22:30:00,triangle,10.0,Pilot witnesses very large&#44 silent&#44 dark grey&#44 triangular craft with glowing lights at each point,8/5/2009,43.6155556,-84.2472222
lake villa,il,2008-03-17,23:00:00,triangle,60.0,TRIANGLE ARRANGED LIGHTS IN LAKE COUNTY&#44 ILLINOIS.  ((NUFORC Note:  Possible sighting of U. S. Navy NOSS satellites?  PD)),7/5/2008,42.4169444,-88.0738889
minneapolis,mn,2008-06-02,22:30:00,light,1200.0,A three-light object was observed hovering and moving above the Wells-Fargo Bldg. in downtown Minneapolis&#44 MN,6/12/2008,44.98,-93.2636111
danville,va,2008-04-25,20:30:00,sphere,240.0,Bright flickering sphere without sound stays in position for almost 5 minutes.,6/12/2008,36.5858333,-79.3952778
st. george,ut,2008-01-23,14:40:00,other,1200.0,3 objects hanging above St. George,2/14/2008,37.1041667,-113.5833333
joplin (south of),mo,2008-06-07,22:50:00,unknown,600.0,Two bright lights flying high overhead in SW Missouri,7/5/2008,37.0841667,-94.5130556
atlanta,ga,2008-02-16,12:30:00,other,2.0,Hovering still curved boxy  20x25 ft. solid dark object over Atlanta freeway.,3/4/2008,33.7488889,-84.3880556
ridgecrest,ca,2008-09-06,20:30:00,light,15.0,Light went from dim to very bright and then to disappearing into the nights sky.,10/31/2008,35.6225,-117.67
kingston,pa,2008-07-04,21:30:00,oval,300.0,In the north sky&#44slowly moving to the south. Hovered for about 1 1/2 minutes as the July 4 fireworks show was going on. Then &quot;zipped&quot; q,8/12/2008,41.2616667,-75.8972222
tucson,az,2008-03-15,19:00:00,fireball,2.0,Large&#44 glowing&#44 floating&#44 red fireball/orb spotted in the sky for a very short time before it disappeared.,3/31/2008,32.2216667,-110.9258333
baker (20 mi. outside of),ca,2008-12-15,01:00:00,rectangle,10.0,orange rectangle runs across ground&#44 turns into sphere and back again,1/10/2009,35.265,-116.0736111
marshalltown,ia,2008-10-02,20:00:00,triangle,5.0,October 2&#44 2008  just after 8 p.m.  Marshalltown&#44 Iowa&#44  saw a black triangular shaped object&#44 with round green lights in  V  pattern,10/31/2008,42.0494444,-92.9077778
starke,fl,2008-10-21,23:00:00,sphere,45.0,VERY BRIGHT SPHERE ABOVE TREE LINES,10/31/2008,29.9438889,-82.11
fairbanks,ak,2008-07-03,16:40:00,unknown,120.0,White oblong object moving fast through clear sky and fades into the blue.,7/5/2008,64.8377778,-147.7163889
blue hills,ma,2008-06-13,09:00:00,disk,30.0,Disc that flashed 3x then slowly disappeared as if by active metamaterial cloaking,8/12/2008,42.2430556,-71.0986111
lake havasu city,az,2008-02-27,21:00:00,oval,30.0,Glowing&#44 amber oval&#44 traveling at 20-30k feet&#44 1200-1400 mph at 9pm AZ time. Did anyone else see this?,3/4/2008,34.4838889,-114.3216667
west monroe,la,2008-03-21,01:15:00,flash,3600.0,Crazy UFOs moving in circular and zig-zagging formations&#44 very fast&#33,10/31/2008,32.5091667,-92.1191667
beaverton,or,2008-03-20,13:35:00,oval,10.0,While driving home for lunch last Thrusday&#44 the heavy rain clouds&#44 had breaks of blue sky here and there.As I approached the stop l,3/31/2008,45.4872222,-122.8025
baton rouge,la,2008-10-08,20:50:00,formation,60.0,Solid lighted aircraft flying in a V formation.,10/31/2008,30.4505556,-91.1544444
hampton,nh,2008-03-30,21:15:00,unknown,2.0,strange object with three glowing lights.,3/31/2008,42.9375,-70.8394444
hammond,in,2008-08-14,20:15:00,unknown,900.0,Pulsating light making circles shooting out different colored balls leads to what looked like an explosion with a flume of smoke rising,10/31/2008,41.5833333,-87.5
